{
  "acceptance_criteria": [
    {
      "demo_required": true,
      "description": "The nominal deterministic scenario onboards an agent, executes explicit movement, equip, and tool-use steps, destroys the correct tree, and saves a verified replay.",
      "id": "WEV-0005-AC-01",
      "proof_types": ["demo", "replay", "test"],
      "replay_required": true
    },
    {
      "demo_required": true,
      "description": "The interrupted scenario reports a barrier without choosing a detour, accepts explicit waypoints, suspends on an enemy, and succeeds only when the agent returns to base without attacking.",
      "id": "WEV-0005-AC-02",
      "proof_types": ["demo", "replay", "test"],
      "replay_required": true
    },
    {
      "demo_required": true,
      "description": "Controller Lab exposes onboarding, objective, grid, plans, leases, interrupts, receipts, evaluation, and saved replay readiness without reporting completion before archival.",
      "id": "WEV-0005-AC-03",
      "proof_types": ["demo", "review", "test"],
      "replay_required": true
    },
    {
      "demo_required": false,
      "description": "Authority-derived metrics verify adaptation, action validity, efficiency, tool choice, replay status, and zero forbidden game-autonomy decisions without an LLM judge.",
      "id": "WEV-0005-AC-04",
      "proof_types": ["test", "metric"],
      "replay_required": false
    }
  ],
  "affected_paths": [
    "worlds/worldarena/games/primitive-sandbox",
    "worlds/worldarena/godot/scripts/agent_sandbox",
    "worlds/worldarena/godot/tests/agent_sandbox",
    "worlds/worldarena/backend/worldarena/primitive_sandbox",
    "worlds/worldarena/backend/worldarena/replay_verifiers.py",
    "worlds/worldarena/backend/genesis_arena/main.py",
    "worlds/worldarena/demos/primitive-sandbox-tree-chop-nominal",
    "worlds/worldarena/demos/primitive-sandbox-tree-chop-interrupted",
    "worlds/worldarena/scripts/build_primitive_sandbox_demos.py",
    "worlds/worldarena/tests/test_primitive_sandbox_api.py",
    "worlds/worldarena/tests/test_primitive_sandbox_sessions.py",
    "apps/worldeval-web",
    ".github/workflows/ci.yml"
  ],
  "dependencies": ["WEV-0002", "WEV-0003", "WEV-0004"],
  "exclusive_shared_surfaces": ["primitive-sandbox-game", "controller-lab-primitive-sandbox"],
  "id": "WEV-0005",
  "kind": "behavioral",
  "priority": "p0",
  "product": "worldarena",
  "related_features": ["WEV-0006"],
  "required_approvals": ["behavioral", "visual"],
  "requirements": {
    "compatibility": ["Use a new semantic-grid profile and do not change existing embodiment leaderboards or controller semantics."],
    "migration": ["Register the sandbox additively as worldarena-primitive-sandbox-v0."],
    "privacy": ["Demo acceptance uses the deterministic provider and contains no live credentials or private provider output."],
    "rollback": ["The isolated game, API adapter, and UI card can be disabled without affecting legacy games."]
  },
  "risk": "high",
  "schema_version": "worldeval/feature/1.0.0",
  "scope": {
    "in": ["30x25 deterministic Godot sandbox", "Nominal and interrupted tree objectives", "Deterministic demo provider and evaluation", "Controller Lab integration", "Accepted replay bundles"],
    "out": ["Live-provider credentials as acceptance dependencies", "Automatic navigation around obstacles", "Combat against the enemy", "Changing existing games"]
  },
  "slug": "primitive-sandbox",
  "summary": "Deliver the first WorldArena environment that proves reusable onboarding, primitive actions, interruption, replanning, deterministic evaluation, and replay evidence.",
  "supersedes": [],
  "title": "WorldArena primitive sandbox and tree-interruption demo"
}
