{
  "acceptance_criteria": [
    {
      "demo_required": false,
      "description": "Native replay formats are preserved inside atomically written, content-sealed worldeval/replay-bundle/1.0.0 directories that reject unsafe or inconsistent artifacts.",
      "id": "WEV-0002-AC-01",
      "proof_types": ["test", "artifact"],
      "replay_required": false
    },
    {
      "demo_required": true,
      "description": "A deterministic demo saves an authority replay before completion and independently verifies it offline with zero provider calls.",
      "id": "WEV-0002-AC-02",
      "proof_types": ["demo", "replay", "test"],
      "replay_required": true
    },
    {
      "demo_required": false,
      "description": "Environment-neutral replay routes expose only allow-listed public files while legacy replay APIs remain compatible.",
      "id": "WEV-0002-AC-03",
      "proof_types": ["test"],
      "replay_required": false
    }
  ],
  "affected_paths": [
    "worldeval/src/worldeval/replay",
    "worldeval/tests",
    "worlds/worldarena/backend",
    "worlds/worldarena/demos"
  ],
  "dependencies": ["WEV-0001"],
  "exclusive_shared_surfaces": ["replay-bundle-format", "public-replay-api"],
  "id": "WEV-0002",
  "kind": "behavioral",
  "priority": "p0",
  "product": "worldeval",
  "related_features": ["WEV-0005", "WEV-0007"],
  "required_approvals": ["behavioral"],
  "requirements": {
    "compatibility": ["Wrap existing native replay formats without changing their bytes or existing route contracts."],
    "migration": ["Normalize future demos first; migrate legacy bundles through additive outer manifests."],
    "privacy": ["Public bundles exclude credentials, prompts, provider output, protected observations, and private authority state."],
    "rollback": ["A failed media render or bundle promotion cannot delete or invalidate a sealed native replay."]
  },
  "risk": "high",
  "schema_version": "worldeval/feature/1.0.0",
  "scope": {
    "in": ["Replay bundle schema and validators", "Atomic persistence and offline verification", "Public replay discovery and safe file access", "Retention and incomplete-run handling"],
    "out": ["Rewriting frozen native replay formats", "Treating authored presentation scripts as authority evidence", "Requiring video for feature acceptance"]
  },
  "slug": "universal-replay-bundles",
  "summary": "Standardize replay-first demo evidence while retaining every environment's authoritative native replay format.",
  "supersedes": [],
  "title": "Universal replay-bundle standard"
}
